!踩尿感拖鞋男室内洗澡防滑防臭特大码凉拖鞋男士	踩屎感儿童凉拖鞋软底云朵男女童夏季居家室内防滑卡通可爱凉鞋	i4/3366872129/O1CN013UFYWz1Rb7ySn7Qyl_!!3366872129.jpg	0
,儿童套装宝宝	夏季女装法式高级感碎花衬衫连衣裙子设计感小众甜美套装裙两件套	i1/3945508051/O1CN014SCaNf29LPTzh6i4Z_!!0-item_pic.jpg	0
,大童套装	纯欲风甜辣妹性感吊带连衣裙碎花套装裙女长袖针织开衫两件套女夏	i4/2212055986062/O1CN01mmHEsQ1ueRhKkrFUu_!!0-item_pic.jpg	0
-aj4蓝麂皮	乔飞天下 Lining李宁 韦德全城9 V1	i3/650601265/O1CN013CE2Ju1LDPmaGMvA6_!!0-item_pic.jpg	0
.灰色短裤	裤子男士2022年新款夏季薄款休闲长裤宽松潮流九分冰丝速干运动裤	i1/2180054355/O1CN01RHvhTD1i2dXQamOfY_!!0-item_pic.jpg	0
0-6个月纯棉连体衣外穿	美国angel dear/甜心安蒂尔 竹纤维女童连体衣短袖新生婴儿包屁衣	i1/2210751349976/O1CN01uNCFWM2NZ3qn5WgLd_!!0-item_pic.jpg	0
020新款女童款套装	欧洲站短款休闲套装女夏宽松连帽无袖卫衣T恤上衣阔腿短裤两件套	i3/2959232624/O1CN01FpscYf1VFq2BAfOsR_!!2959232624.jpg	0
0—8月婴儿鞋	学步鞋女宝宝凉鞋夏季婴儿鞋子软底防滑男童0-1岁3透气网鞋布单鞋	i2/3937219703/O1CN01l44g7B2LY1mqn8dGX_!!3937219703-0-C2M.jpg	0
0一3个月婴儿衣服套盒	minizone婴儿短袖连体衣夏季新款包屁衣宝宝纯棉三角哈衣薄款爬服	i2/1070234108/O1CN01TfWG1E1gDVhwlaaCn_!!0-item_pic.jpg	0
1. 鹿人冰山爆爽裤	棉麻短裤女夏宽松2022新款直筒薄款休闲高腰妈妈显瘦阔腿五分裤潮	i4/1595357345/O1CN01je7rA52483haoP9vA_!!1595357345.jpg	0
100%桑蚕丝打底裤7分裤	纯棉安全裤防走光女夏薄款大码胖mm内外穿宽松不卷边保险打底短裤	i4/3937219703/O1CN0127B8yu2LY1mbkCsBm_!!3937219703-0-C2M.jpg	0
10008541	亏本特价CONVERSE匡威夏款男士 圆领纯棉短袖男子T恤10008135-A03	https://img.alicdn.com/imgextra/i1/1060565329/O1CN01IqzImp1pEjORFeD7z_!!0-item_pic.jpg	1
10个宝宝鞋子	学步鞋婴儿鞋童鞋男宝宝鞋夏季鞋子0-1-3岁2凉鞋男宝宝鞋女童镂空	i1/1583845113/O1CN01zN1vzm1ndnpXHQ1je_!!1583845113.jpg	0
10个月女宝宝秋装加厚	英国NEXT夏季吊带宝宝纯棉连体衣新生婴儿背心男哈衣女透气爬爬服	i2/2144689073/O1CN01vngQDl2GtUFYJoipN_!!2144689073.jpg	0
10元钱的好看鞋	回力老人鞋女春夏2022中老年妈妈鞋软底防滑健步鞋网面透气一脚蹬	i1/2624347467/O1CN01C51MgZ251w9unXUcp_!!2624347467.jpg	0
10岁女孩夏季短裤	女童短裤夏季薄款2022新款洋气儿童夏装裤子女大童外穿夏款牛仔裤	i2/3477910251/O1CN01M1qSLc1Dj09okVmA1_!!0-item_pic.jpg	1
10岁女孩夏装套装	女童网红套装2022新款夏装时髦洋气中大童休闲儿童夏季女孩两件套	i4/3333269676/O1CN01ZTOh2E2LLf55tRRVI_!!0-item_pic.jpg	1
10岁男孩运动套装小学生衣服夏装	耐克顿运动休闲夏季新款韩版纯棉百搭两件套洋气七分裤显瘦套装女	i2/2213269163272/O1CN01szOtU11a2cgBnVsbA_!!2213269163272.jpg	0
11an t恤	ins超火字母印花超薄长袖防晒T恤女2022夏季宽松圆领罩衫上衣潮	https://img.alicdn.com/imgextra/i3/1716520532/O1CN017mwRVp1FnhSLVqRon_!!1716520532.jpg	1
11岁女孩休闲裤	2022新款女童裤子洋气儿童夏季薄款冰丝格子防蚊裤时髦中大童夏装	i2/2193923168/O1CN016rksa01ZGzTxhUpF2_!!2193923168.jpg	1
11岁女孩背带裤鞋	板牙男童牛仔裤子春装春秋款婴儿童装宝宝休闲长裤小童洋气小童潮	i4/24023662/O1CN01Utgo5X1cvF9de6S0b_!!0-item_pic.jpg	0
11岁的儿童睡衣	儿童摄影主题服装新生儿满月百天照宝宝连体衣GUCCI富婆潮牌服饰	i1/3536653276/O1CN01Wkw0uI1a4SC2Ox76X_!!0-item_pic.jpg	0
11岁胖女孩的衣服	女童夏装套装网红夏季洋气2022新款时髦中大童儿童女孩运动服童装	i1/2200566313775/O1CN01O94njC1dkzpclAkSx_!!0-item_pic.jpg	1
120斤直筒卫裤	开叉阔腿裤女夏季薄款雪纺九分高腰宽松显瘦冰丝休闲七分直筒裤子	i3/1790134305/O1CN01bv46vj1hfjouxpLJU_!!1790134305.jpg	0
1215824009N奥康	奥康男鞋2022春季新款商务休闲真皮男士豆豆鞋软皮高端镂空皮鞋男	https://img.alicdn.com/imgextra/i1/2375478318/O1CN01pcZntK2BJh9f90g0V_!!0-item_pic.jpg	1
12到15岁大童男装	夏装大童纯棉短袖t恤13初中学生12岁男孩运动短裤套装潮15青少年	i1/3395247229/O1CN012zt7uP23Gvtu9yEAZ_!!0-item_pic.jpg	1
12到15岁大童裤	男童短裤夏季外穿薄款儿童休闲中裤中大童五分裤2022新款夏装潮牌	i2/1085780193/O1CN01PxQVzN1DIRBnuTUz3_!!1085780193.jpg	0
12岁公主牛仔大裤衩	OLA MIMI 定制儿童 2022夏 两色可调节休闲背带裤 宽松连体裤	i4/4050655529/O1CN01QeQ0041qiKb2C1Big_!!4050655529.jpg	0
12岁初中女生夏装	童泰婴儿短袖套装纯棉夏季薄款宝宝衣服婴幼儿夏装两件套儿童1岁2	i3/1969735364/O1CN014QnfiF1pUlFpqIL7A_!!1969735364.jpg	0
12岁男孩软面料牛仔中裤	巴拉巴拉1-6女宝宝薄款软牛仔短裤女婴儿童2022夏季新款3女童洋气	i2/2211924413200/O1CN01MPyQPW1ZVeA1ofpOC_!!2211924413200.jpg	0
12岁男孩运动套装	男童篮球服速干套装无袖夏季背心儿童薄款男孩夏装中大童运动球衣	i1/2072532830/O1CN014A58nu1WmBcX297cH_!!0-item_pic.jpg	1
12岁男童夏装套装	男童夏季套装帅气衣服童装大童潮牌12岁男孩短袖纯棉儿童夏装薄款	i3/1963313532/O1CN01sAEjmY1bxhaBcwfCQ_!!0-item_pic.jpg	1
12生肖卡通衣服成都店	成都高端六一儿童动物演出服连体成人卡通动物舞台节日晚会表演服	https://img.alicdn.com/imgextra/i2/2211413267331/O1CN01of8jtS241eIoUe0OY_!!0-item_pic.jpg	1
1381蓝色条纹	金盾春秋男士长袖衬衫商务休闲韩版修身衬衣男装职业正装寸衣上衣	https://img.alicdn.com/imgextra/i2/2314481080/O1CN01f9ilxt1JqgVtQYsue_!!2314481080.jpg	1
138444317	回力手绘猫咪做核酸小白鞋女2022新款小众鞋子女生百搭夏季ins潮	i1/3695718833/O1CN015JRovC2F7ZCQui0LT_!!0-item_pic.jpg	0
13demarco鸭舌帽	正品代购13demarco22春夏季新款梵高星月夜趴趴小熊向日葵渔夫帽	i2/157434958/O1CN01v0Yf1z1mUoS2kkOGM_!!0-item_pic.jpg	1
13岁男孩七分裤	男童裤子夏装2022新款洋气儿童宽松七分运动裤男孩薄款休闲中裤潮	i1/2201053939733/O1CN012bdTsA2LllfQ6U4H2_!!2201053939733.jpg	1
13岁男孩牛仔裤子夏	男童防蚊裤夏装2022新款薄款儿童中大童休闲运动宽松长裤子洋气潮	i1/2090155038/O1CN01jfsvcu1n5S7uBxeER_!!0-item_pic.jpg	0
14女童安全裤	南极人大码胖mm鲨鱼安全裤女夏防走光收腹提臀义乌可外穿打底短裤	i2/1765299790/O1CN01hA2U3r2MBsEg9kHQM_!!0-item_pic.jpg	0
14岁5分裤连体女泳衣	女童泳衣2022夏装新款儿童宝宝韩版洋气女孩泳装网红连体游泳衣	i4/849157877/O1CN01LARF1i283iZFAFExi_!!0-item_pic.jpg	0
14岁男孩子的拖鞋	买一送一凉拖鞋女夏季卡通情侣室内浴室防滑软底家居一对拖鞋男士	i1/2206645051677/O1CN013VnPtI1OG6wP9n5ZT_!!0-item_pic.jpg	0
150穿搭套装 xs夏天	urbanic30法式复古刺绣字母运动休闲高腰短裤女韩国小众设计买手	i4/87792310/O1CN01vxwp831Sw1fWnh3tQ_!!87792310.jpg	0
150纯欲套装	女童两件套装2022夏季新款儿童短袖夏装中大童时尚短裤女孩时尚潮	i3/521600656/O1CN01s4DaJv1GiUZ1tdUFb_!!0-item_pic.jpg	0
155内常女童单鞋	卓诗尼童鞋儿童公主鞋2022夏季新款透气女童皮鞋小女孩低跟演出鞋	i1/3020560741/O1CN01vwBspq1HLQEEdLq3L_!!0-item_pic.jpg	0
15个月男宝宝衣服开裆	考拉鼻鼻女宝宝夏季透气连体衣婴儿公主哈衣爬服薄款衣服夏装粉花	i1/2200742099421/O1CN01S1vUE32JSs5xvddMs_!!2200742099421.jpg	0
15岁女孩夏季九分裤卡通	巴拉左西男童防蚊裤儿童夏装大童男孩运动冰丝速干长裤子夏季薄款	i4/726716087/O1CN01CFujZ11uptbleVL9i_!!0-item_pic.jpg	0
160100裤子	西装阔腿裤女夏季垂感高腰薄款2022年新款宽松卡其色直筒拖地裤子	i4/2113790535/O1CN01a5lGQI1Fp4eEIGqm0_!!0-item_pic.jpg	1
160码女童运动裤	儿童防蚊裤男童装夏季薄款长裤子冰丝宝宝夏天睡裤女童夏装灯笼裤	i1/3201997862/O1CN014tvqCw27wqcJtPUXx_!!3201997862.jpg	0
16岁男孩子穿的裤子 凉感	儿童西装短裤夏装韩版男童休闲五分裤小童宝宝百搭纯棉棉布中裤潮	i2/1648251171/O1CN01dKjaC11KWMXkoXuUC_!!1648251171.jpg	0
16岁男孩时尚套装	女童夏季套装2022新款洋气时髦短袖童装夏装中大童儿童两件套夏款	i1/2094881377/O1CN01P5r6yb1M2i7zJypSY_!!0-item_pic.jpg	0
